{
  "name": "profile_python_data_cli",
  "profile": "python_data_cli",
  "limit": 15,
  "samples": [
    {
      "id": "python_pytorch_profiler_excellent",
      "sourceTier": "gfi_trusted",
      "issue": {
        "repoFullName": "PyTorchLightning/pytorch-lightning",
        "number": 9136,
        "title": "AdvancedProfiler ValueError stopping action that was never started",
        "body": "AdvancedProfiler raises ValueError when stopping run_test_evaluation that was never started. Steps to reproduce: run validation with AdvancedProfiler enabled. Expected behavior: profiler handles missing action safely. Suggested fix: guard stop calls and add a regression test.",
        "labels": ["bug", "good first issue"],
        "createdAgeDays": 1200,
        "updatedAgeDays": 240
      },
      "repository": {
        "description": "Python machine learning training framework",
        "language": "Python",
        "stars": 29000,
        "forks": 3500,
        "watchers": 350,
        "openIssues": 900,
        "topics": ["python", "testing", "machine-learning"],
        "pushedAgeDays": 2
      },
      "expected": {
        "quality": "excellent",
        "behavior": "visible_top",
        "minProfileFit": 80,
        "reasons": ["Python testing bug with concrete reproduction and regression path."]
      }
    },
    {
      "id": "python_ipython_autocomplete_good",
      "sourceTier": "gfi_trusted",
      "issue": {
        "repoFullName": "ipython/ipython",
        "number": 12105,
        "title": "How can I disable filename abbreviations in tab-autocompletion results",
        "body": "Tab completion abbreviates long filenames in the terminal UI. Steps to reproduce: create long file names and use IPython completion. Expected behavior: configuration can disable abbreviation. Suggested fix: expose a config flag and verify with completion tests.",
        "labels": ["good first issue", "enhancement"],
        "createdAgeDays": 1600,
        "updatedAgeDays": 70
      },
      "repository": {
        "description": "Interactive Python shell and CLI",
        "language": "Python",
        "stars": 17000,
        "forks": 4500,
        "watchers": 300,
        "openIssues": 520,
        "topics": ["python", "cli", "terminal"],
        "pushedAgeDays": 5
      },
      "expected": {
        "quality": "good",
        "behavior": "visible",
        "reasons": ["Python CLI issue with testable behavior."]
      }
    },
    {
      "id": "python_uv_parent_package_good",
      "sourceTier": "gfi_trusted",
      "issue": {
        "repoFullName": "astral-sh/uv",
        "number": 7040,
        "title": "[feat] Log parent package when erroring during dependency install",
        "body": "When uv fails during dependency install, the error does not show the parent package that introduced the dependency. Expected behavior: CLI logs the parent package chain. Suggested fix: include parent package context in resolver errors and add CLI snapshot tests.",
        "labels": ["help wanted", "cli", "error messages"],
        "createdAgeDays": 640,
        "updatedAgeDays": 2
      },
      "repository": {
        "description": "Fast Python package manager and CLI",
        "language": "Rust",
        "stars": 30000,
        "forks": 1000,
        "watchers": 300,
        "openIssues": 650,
        "topics": ["python", "cli", "developer-tools"],
        "pushedAgeDays": 1
      },
      "expected": {
        "quality": "good",
        "behavior": "visible",
        "reasons": ["Rust implementation but strong Python CLI profile fit."]
      }
    },
    {
      "id": "python_pants_skip_warning_good",
      "sourceTier": "profile_trusted",
      "issue": {
        "repoFullName": "pantsbuild/pants",
        "number": 13825,
        "title": "Confusing warning message when running on a target with skip_*",
        "body": "Running Pants on a target with skip_* emits a confusing warning. Steps to reproduce: configure a target with skip tests, run the Pants CLI, and observe the warning. Expected behavior: warning should explain why the target was skipped and include the target address. Suggested fix: update the warning path and add a regression test.",
        "labels": ["bug", "good first issue", "onboarding"],
        "createdAgeDays": 120,
        "updatedAgeDays": 1
      },
      "repository": {
        "description": "Python build system and CLI for monorepos",
        "language": "Python",
        "stars": 3600,
        "forks": 560,
        "watchers": 95,
        "openIssues": 680,
        "topics": ["python", "build-system", "cli", "testing"],
        "pushedAgeDays": 1
      },
      "expected": {
        "quality": "good",
        "behavior": "visible",
        "minProfileFit": 80,
        "reasons": ["Python CLI tooling bug with concrete reproduction and regression path."]
      }
    },
    {
      "id": "python_hatch_optional_uv_good",
      "sourceTier": "profile_trusted",
      "issue": {
        "repoFullName": "pypa/hatch",
        "number": 2141,
        "title": "Make uv optional",
        "body": "Hatch currently assumes uv is installed for an environment path. Steps to reproduce: run hatch env show without uv installed and observe the failure. Expected behavior: Hatch should gracefully fall back or report a clear optional dependency message. Suggested fix: guard the uv call and add CLI tests.",
        "labels": ["enhancement", "good first issue"],
        "createdAgeDays": 80,
        "updatedAgeDays": 20
      },
      "repository": {
        "description": "Python project manager and environment CLI",
        "language": "Python",
        "stars": 6700,
        "forks": 350,
        "watchers": 70,
        "openIssues": 260,
        "topics": ["python", "packaging", "cli"],
        "pushedAgeDays": 2
      },
      "expected": {
        "quality": "good",
        "behavior": "visible",
        "minProfileFit": 80,
        "reasons": ["Python packaging CLI issue with clear fallback behavior and tests."]
      }
    },
    {
      "id": "python_cdk_weak_profile",
      "sourceTier": "gfi_trusted",
      "issue": {
        "repoFullName": "aws/aws-cdk",
        "number": 26935,
        "title": "(aws-glue-alpha): struct schema produces unsupported inputStrings",
        "body": "Schema.struct generates invalid inputStrings for nested Glue structs. Steps to reproduce: build nested struct schema and query with Athena. Suggested fix: update TypeScript schema rendering.",
        "labels": ["bug", "good first issue"],
        "createdAgeDays": 1010,
        "updatedAgeDays": 12
      },
      "repository": {
        "description": "Cloud development kit",
        "language": "TypeScript",
        "stars": 12794,
        "forks": 4200,
        "watchers": 200,
        "openIssues": 2700,
        "topics": ["typescript", "cloud", "infrastructure"],
        "pushedAgeDays": 1
      },
      "expected": {
        "quality": "weak",
        "behavior": "visible_lower",
        "rejectReasons": ["profile_mismatch"],
        "reasons": ["Not Python/data/CLI despite high repo influence."]
      }
    },
    {
      "id": "python_dotnet_command_line_profile_mismatch",
      "sourceTier": "gfi_trusted",
      "issue": {
        "repoFullName": "dotnet/command-line-api",
        "number": 2137,
        "title": "GetCompletions should check exit code of invoked application",
        "body": "Suggestion completions should check the invoked command exit code and avoid treating non-zero stdout as completions.",
        "labels": ["bug", "help wanted"],
        "createdAgeDays": 1400,
        "updatedAgeDays": 30
      },
      "repository": {
        "description": "Command-line parser and completions for .NET",
        "language": "C#",
        "stars": 3665,
        "forks": 423,
        "watchers": 241,
        "openIssues": 250,
        "topics": ["command-line", "terminal", "parser"],
        "pushedAgeDays": 1
      },
      "expected": {
        "quality": "reject",
        "behavior": "hidden",
        "rejectReasons": ["profile_mismatch"],
        "reasons": ["Generic command-line evidence without Python/data context should not satisfy the Python data/CLI profile."]
      }
    },
    {
      "id": "python_sample_notebook_docs_noise",
      "sourceTier": "gfi_trusted",
      "issue": {
        "repoFullName": "datafuselabs/datafuse",
        "number": 17460,
        "title": "Feature: add sample directory with jupyter notebook",
        "body": "Add sample directory with Jupyter notebook to streamline onboarding. Provide interactive learning resources, tutorial structure, hands-on examples, and integration guides.",
        "labels": ["C-feature", "good first issue"],
        "createdAgeDays": 60,
        "updatedAgeDays": 10
      },
      "repository": {
        "description": "Cloud native data warehouse with SQL and Python examples",
        "language": "Rust",
        "stars": 9313,
        "forks": 880,
        "watchers": 93,
        "openIssues": 1000,
        "topics": ["data", "python", "sql"],
        "pushedAgeDays": 1
      },
      "expected": {
        "quality": "reject",
        "behavior": "hidden",
        "rejectReasons": ["toy_no_code"],
        "reasons": ["Sample notebook and onboarding tutorial work is documentation/content noise."]
      }
    },
    {
      "id": "python_created_pr_comment_should_hide",
      "sourceTier": "gfi_trusted",
      "issue": {
        "repoFullName": "datafuselabs/datafuse",
        "number": 5039,
        "title": "Add valgrind stateless test for check memory leak",
        "body": "Add a valgrind stateless test for checking memory leaks. Suggested validation: run the stateless test suite with cargo-valgrind.",
        "labels": ["C-testing", "good first issue"],
        "createdAgeDays": 1000,
        "updatedAgeDays": 60
      },
      "repository": {
        "description": "Cloud native data warehouse with SQL and Python examples",
        "language": "Rust",